{
  "schema_version": "1.0",
  "last_reviewed": "2026-10-23",
  "current_development_phase": 5,
  "current_milestone_id": "phase-5a",
  "milestones": [
    {
      "id": "phase-0",
      "title": "Runtime and integration assessment",
      "status": "Demonstrated",
      "summary": "The assessment selected GitHub Actions with pinned DeepSeek Harness for the tested configuration.",
      "limitations": [
        "Boundary and cancellation coverage remained partial.",
        "The diagnosis rubric was visible to the candidate.",
        "The assessment does not establish production readiness."
      ],
      "evidence_links": []
    },
    {
      "id": "phase-1a",
      "title": "Synthetic pipeline",
      "status": "Accepted",
      "summary": "The synthetic pipeline gate was accepted and closed.",
      "limitations": [
        "Acceptance applies to its recorded synthetic scope."
      ],
      "evidence_links": []
    },
    {
      "id": "phase-1b",
      "title": "Live-agent engineering",
      "status": "Closed with exception",
      "summary": "The phase closed under an explicit owner exception.",
      "limitations": [
        "The exception does not establish successful completion of the original live protocol.",
        "Full runtime qualification was not accepted.",
        "Actual provider billing remains unknown."
      ],
      "evidence_links": []
    },
    {
      "id": "phase-2",
      "title": "Issue to verified draft PR",
      "status": "Accepted with limitations",
      "summary": "A deterministic change reached an open draft PR with the exact verified candidate through an owner-started retained-candidate continuation.",
      "limitations": [
        "No Phase 2 model call or live AI coding proof.",
        "Automatic issue forwarding and one uninterrupted issue-to-PR execution were not demonstrated.",
        "No merge, deployment, production remediation, or general runtime qualification was demonstrated.",
        "The original publisher failure cause remains unknown."
      ],
      "evidence_links": []
    },
    {
      "id": "phase-3",
      "title": "CI diagnosis and repair",
      "status": "Accepted with limitations",
      "summary": "The owner accepted the bounded Phase 3 proof on 15 October 2026. Hosted results include a verified narrow repair published as an exact draft PR, an owner-performed merge, and an infrastructure diagnosis without source changes. The uncertain-report outcome was accepted.",
      "limitations": [
        "Successful intermittent-failure classification remains unqualified. The comparison retained Unknown because execution conditions differed.",
        "The proof used owner-started workflows, one controlled application profile, and a deterministic repair. It does not qualify live-model or general autonomous remediation.",
        "Retained-state replay checks were local. No new SDK verification of the merged product commit or deployment is claimed."
      ],
      "evidence_links": []
    },
    {
      "id": "phase-4",
      "title": "Alert investigation and approvals",
      "status": "Accepted with limitations",
      "summary": "The owner accepted the bounded synthetic Phase 4 PoC on 18 October 2026. Hosted investigation, two native owner approvals, protected original reproduction and a verified one-line repair reached exact draft publication. The owner separately approved and merged the repair.",
      "limitations": [
        "One publication-accounting invocation missed its approved deadline. Acceptance carries this operational exception without retroactively authorizing the violation.",
        "Synthetic input, deterministic repair and owner-started stages do not qualify production monitoring, general autonomous repair or live-model use.",
        "Full live negative and active-cancellation coverage remains unqualified despite passing local tests.",
        "Current comment reads do not eliminate API check-to-write races. Unavailability does not prove deletion or grant approval.",
        "Reserved accounting allowances remain explicit in private evidence; actual billed usage is unknown.",
        "No deployment, production remediation or next-phase authority is claimed."
      ],
      "evidence_links": []
    },
    {
      "id": "phase-5a",
      "title": "Same-runtime Factory evaluation",
      "status": "Stopped — incomplete",
      "summary": "Technical feasibility was demonstrated within the tested scope. Comparative benefit over Baseline was not demonstrated. Further paid Phase 5A execution has stopped. The evaluation remains incomplete: 18 of 20 original attempts were consumed; both A1 attempts remain blocked and unexecuted.",
      "limitations": [
        "Fifteen original attempts have linked CORRECT outcomes. Two C2 attempts were collection rejections; one I2 Factory attempt produced INVALID_OUTPUT.",
        "The six completed flat-json-v2 pairs produced six CORRECT outcomes per treatment. Original v1 and flat-json-v2 groups remain separate; supplemental C2 pilots do not replace original outcomes.",
        "Human scoring used owner self-review with fixture-author overlap. Independent human review is not claimed.",
        "Original-cohort and treatment-specific actual billed costs and measured human engineering effort remain UNKNOWN. Comparative cost and human-effort thresholds are not established as PASS.",
        "A1 review and implementation-approval requirements remain unmet. An approved scheduling exception allowed A2 and A3 to proceed while A1 stayed blocked.",
        "The exploratory result does not establish full Phase 5A acceptance, production readiness, general autonomous remediation or proven productivity improvements."
      ],
      "evidence_links": []
    },
    {
      "id": "phase-5b",
      "title": "Optional second runtime",
      "status": "Planned",
      "summary": "Optionally evaluate a second runtime under shared task and acceptance contracts.",
      "limitations": [
        "This phase is optional and has not started."
      ],
      "evidence_links": []
    },
    {
      "id": "phase-6",
      "title": "Limited pilot and automatic recovery",
      "status": "Planned",
      "summary": "Qualify recovery, retention, access, reconciliation, and operations before a limited pilot.",
      "limitations": [
        "Automatic recovery is not enabled."
      ],
      "evidence_links": []
    },
    {
      "id": "phase-7",
      "title": "Broader product",
      "status": "Planned",
      "summary": "Prioritize expansion from pilot evidence.",
      "limitations": [
        "Scope remains future work."
      ],
      "evidence_links": []
    }
  ]
}
